kind,title,htmlTitle,link,displayLink,snippet,htmlSnippet,formattedUrl,htmlFormattedUrl,pagemap
customsearch#result,"Top 10 Hotels in New York, NY (from $131) - Competitive Prices ...","Top 10 <b>Hotels</b> in <b>New York</b>, <b>NY</b> (from $131) - Competitive Prices ...",https://www.expedia.com/New-York-Hotels.d178293.Travel-Guide-Hotels,www.expedia.com,"Find 8559 of the best hotels in New York, NY in 2025. Compare room rates, hotel reviews and availability. Most hotels are fully refundable.","Find 8559 of the best <b>hotels</b> in <b>New York</b>, <b>NY</b> in 2025. Compare room rates, <b>hotel</b> reviews and availability. Most <b>hotels</b> are fully refundable.",https://www.expedia.com/New-York-Hotels.d178293.Travel-Guide-Hotels,https://www.expedia.com/<b>New</b>-<b>York</b>-<b>Hotels</b>.d178293.Travel-Guide-<b>Hotels</b>,"{'cse_thumbnail': [{'src': 'https://encrypted-tbn0.gstatic.com/images?q=tbn:ANd9GcTW3t92NPZJPTMXQqoRszAAygIzn1HhDWspNLfD3c2qel8UkLr7S1haIrY&s', 'width': '285', 'height': '177'}], 'metatags': [{'data-fm-seo': 'EM[1335775]', 'og:image': 'https://images.trvl-media.com/place/178293/4ff3810c-d301-4f24-af8b-2337e9d4d10f.jpg?impolicy=fcrop&w=450&h=280&q=medium', 'theme-color': '#000000', 'flex:template-version': '791', 'og:type': 'website', 'flex:template-fm-id': '14949', 'og:site_name': 'Expedia.com', 'og:title': 'Top 10 Hotels in New York, NY (from $131) - Competitive Prices | Expedia', 'og:image:type': 'image/jpeg', 'ewe:page': 'FLEX', 'og:description': 'Find 8,559 of the best hotels in New York, NY in 2025. Compare room rates, hotel reviews and availability. Most hotels are fully refundable.', 'essclientid': 'flex.hotel.Travel-Guide-Hotels', 'viewport': 'width=device-width, initial-scale=1.0', 'apple-mobile-web-app-capable': 'yes', 'flex:page-type': 'Travel-Guide-Hotels', 'mobile-web-app-capable': 'yes', 'og:locale': 'en_US', 'flex:template-id': '1-en_US-Travel-Guide-Hotels-citymc-Blossom-Desktop-Like-HSR', 'og:url': 'https://www.expedia.com/New-York-Hotels.d178293.Travel-Guide-Hotels'}], 'cse_image': [{'src': 'https://images.trvl-media.com/place/178293/4ff3810c-d301-4f24-af8b-2337e9d4d10f.jpg?impolicy=fcrop&w=450&h=280&q=medium'}]}"
customsearch#result,New Yorker by Lotte Hotels | Midtown Manhattan Hotel in NYC,New Yorker by Lotte <b>Hotels</b> | Midtown Manhattan <b>Hotel</b> in <b>NYC</b>,https://www.newyorkerhotel.com/,www.newyorkerhotel.com,"Experience timeless style at New Yorker by Lotte Hotels - iconic Midtown Manhattan stay just steps from Penn Station, Madison Square Garden & Times Square.","Experience timeless style at <b>New</b> Yorker by Lotte <b>Hotels</b> - iconic Midtown Manhattan stay just steps from Penn Station, Madison Square Garden &amp; Times Square.",https://www.newyorkerhotel.com/,https://www.<b>newyork</b>erhotel.com/,"{'cse_thumbnail': [{'src': 'https://encrypted-tbn0.gstatic.com/images?q=tbn:ANd9GcSEC_DXJ5BjKUsTkeoorMlYLazN-xh8XDXpIPsSBLoxCxIBpE_qvRSIdkw&s', 'width': '300', 'height': '156'}], 'metatags': [{'p:domain_verify': 'c2bb94a978acaca34c5eecc00d697453', 'twitter:title': 'New Yorker by Lotte Hotels | Midtown Manhattan Hotel in NYC', 'twitter:card': 'summary', 'og:site_name': 'The New Yorker by Lotte Hotels', 'handheldfriendly': 'True', 'twitter:url': 'https://www.newyorkerhotel.com/', 'og:title': 'New Yorker by Lotte Hotels | Midtown Manhattan Hotel in NYC', 'og:description': 'Experience timeless style at New Yorker by Lotte Hotels - iconic Midtown Manhattan stay just steps from Penn Station, Madison Square Garden & Times Square.', 'facebook-domain-verification': 'tlv10u72965bytn5w6b4387c4fo3vp', 'twitter:site': '@WyndhamNYH', 'viewport': 'width=device-width, initial-scale=1.0', 'twitter:description': 'Experience timeless style at New Yorker by Lotte Hotels - iconic Midtown Manhattan stay just steps from Penn Station, Madison Square Garden & Times Square.', 'mobileoptimized': '320', 'og:locale': 'en', 'og:url': 'https://www.newyorkerhotel.com/'}], 'cse_image': [{'src': 'https://res.cloudinary.com/traveltripperweb/image/upload/c_fit,f_auto,h_300,q_auto,w_300/v1754060060/adqcnpiyikg52ibshhfe.png'}]}"
customsearch#result,Which luxe hotels are people loving in New York these days? : r ...,Which luxe <b>hotels</b> are people loving in <b>New York</b> these days? : r ...,https://www.reddit.com/r/chubbytravel/comments/1n7jro1/which_luxe_hotels_are_people_loving_in_new_york/,www.reddit.com,"Sep 3, 2025 ... Aman New York and Four Seasons Downtown are both fantastic if you want that seamless, high-end experience with top-notch service and amenities ( ...","Sep 3, 2025 <b>...</b> Aman <b>New York</b> and Four Seasons Downtown are both fantastic if you want that seamless, high-end experience with top-notch service and amenities (&nbsp;...",https://www.reddit.com/.../which_luxe_hotels_are_people_loving_in_new_...,https://www.reddit.com/.../which_luxe_<b>hotels</b>_are_people_loving_in_<b>new</b>_...,"{'metatags': [{'og:image': 'https://share.redd.it/preview/post/1n7jro1', 'theme-color': '#000000', 'og:image:width': '1200', 'og:type': 'website', 'og:image:alt': 'An image containing a preview of the post', 'twitter:card': 'summary_large_image', 'twitter:title': 'r/chubbytravel on Reddit: Which luxe hotels are people loving in New York these days?', 'og:site_name': 'Reddit', 'og:title': 'r/chubbytravel on Reddit: Which luxe hotels are people loving in New York these days?', 'og:image:height': '630', 'msapplication-navbutton-color': '#000000', 'og:description': 'Posted by u/alex_travels - 48 votes and 100 comments', 'twitter:image': 'https://share.redd.it/preview/post/1n7jro1', 'apple-mobile-web-app-status-bar-style': 'black', 'twitter:site': '@reddit', 'viewport': 'width=device-width, initial-scale=1, viewport-fit=cover', 'apple-mobile-web-app-capable': 'yes', 'og:ttl': '600', 'og:url': 'https://www.reddit.com/r/chubbytravel/comments/1n7jro1/which_luxe_hotels_are_people_loving_in_new_york/?seeker-session=true'}]}"
customsearch#result,The 10 Best New York Hotels (From $117),The 10 Best <b>New York Hotels</b> (From $117),https://www.booking.com/city/us/new-york.html,www.booking.com,"Great savings on hotels in New York, United States online. Good availability and great rates. Read hotel reviews and choose the best hotel deal for your ...","Great savings on <b>hotels</b> in <b>New York</b>, United States online. Good availability and great rates. Read <b>hotel</b> reviews and choose the best <b>hotel</b> deal for your&nbsp;...",https://www.booking.com/city/us/new-york.html,https://www.booking.com/city/us/<b>new</b>-<b>york</b>.html,"{'cse_thumbnail': [{'src': 'https://encrypted-tbn0.gstatic.com/images?q=tbn:ANd9GcR1SiuE0AO5mRgAAdeKI8HI8TEQnV-jTBTF8oFVVjb21sCQ_1EDLvSUTRrh&s', 'width': '389', 'height': '129'}], 'question': [{'name': 'How much does it cost to stay in a hotel in New York?'}, {'name': 'How much is a hotel in New York for this weekend?'}, {'name': 'How much is a hotel in New York for tonight?'}, {'name': 'Which hotels in New York are good for families?'}, {'name': 'What are the best hotels in New York near Times Square?'}, {'name': 'What are the best hotels in New York near John F. Kennedy International Airport?'}, {'name': 'Which hotels are the best ones to stay at in New York?'}, {'name': 'Which hotels in New York offer an especially good breakfast?'}, {'name': 'Which hotels in New York are good for couples?'}, {'name': 'Which hotels in New York have nice views?'}], 'answer': [{'text': ""On average, 3-star hotels in New York cost $300 per night, and 4-star hotels in New York are $409 per night. If you're looking for something really special, a 5-star hotel in New York can be...""}, {'text': 'The average price per night for a 3-star hotel in New York this weekend is $456 or, for a 4-star hotel, $521. Looking for something even fancier? 5-star hotels in New York for this weekend...'}, {'text': ""On average, it costs $393 per night to book a 3-star hotel in New York for tonight. You'll pay around $482 if you choose to stay in a 4-star hotel tonight, while a 5-star hotel in New York...""}, {'text': ""Many families visiting New York loved staying at Warren Street Hotel, Four Seasons Hotel New York, and Fouquet's New York.""}, {'text': 'Some of the best hotels in New York near Times Square include Casablanca Hotel by Library Hotel Collection, Hotel Scherman and LUMA Hotel - Times Square.'}, {'text': 'Travelers who stayed in New York near John F. Kennedy International Airport (JFK) have said good things about Fairfield Inn by Marriott JFK Airport, Marriott New York JFK Airport, and Residence...'}, {'text': 'The Hotel Chelsea, The Wallace Hotel, and Artezen Hotel are some of the popular hotels in New York.'}, {'text': 'For hotels in New York that serve highly-rated breakfasts, try The Bowery Hotel, NobleDEN Hotel, and Crosby Street Hotel.'}, {'text': 'These hotels in New York are highly rated by couples: Crosby Street Hotel, The Whitby Hotel, and The Hotel Chelsea.'}, {'text': 'Mandarin Oriental, New York, The Wallace Hotel, and The Wall Street Hotel New York City got great room view-related reviews from travelers in New York.'}], 'postaladdress': [{'addresslocality': 'New York', 'streetaddress': '308 W 58th Street'}, {'addresslocality': 'New York', 'streetaddress': '80 Columbus Circle'}, {'addresslocality': 'New York', 'streetaddress': '244 West 56th street'}, {'addresslocality': 'New York', 'streetaddress': '940 8th Avenue'}, {'addresslocality': 'New York', 'streetaddress': '243 West 55th Street'}, {'addresslocality': 'New York', 'streetaddress': '200 West 56th Street'}, {'addresslocality': 'New York', 'streetaddress': '44 West 63rd Street'}, {'addresslocality': 'New York', 'streetaddress': '153 West 57th Street'}, {'addresslocality': 'Haberman', 'streetaddress': '50-44 47th Street'}, {'addresslocality': 'Jersey City', 'streetaddress': 'Magnolia Avenue'}, {'addresslocality': 'Jersey City', 'streetaddress': '829 Newark Avenue'}, {'addresslocality': 'Jersey City', 'streetaddress': '815 Pavonia Avenue'}, {'addresslocality': 'New York', 'streetaddress': 'One Central Park West'}, {'addresslocality': 'New York', 'streetaddress': '940 8th Avenue'}, {'addresslocality': 'New York', 'streetaddress': '940 8th Avenue'}, {'addresslocality': 'New York', 'streetaddress': '940 8th Avenue'}, {'addresslocality': 'New York', 'streetaddress': '201 West 55th Street'}, {'addresslocality': 'New York', 'streetaddress': '210 West 55th Street'}, {'addresslocality': 'New York', 'streetaddress': '119 West 56th Street'}, {'addresslocality': 'New York', 'streetaddress': '151 West 54th Street'}, {'addresslocality': 'New York', 'streetaddress': '1414 Avenue of the Americas'}, {'addresslocality': 'New York', 'streetaddress': '50 Central Park South'}, {'addresslocality': 'New York', 'streetaddress': '811 7th Avenue, 53rd Street'}, {'addresslocality': 'New York', 'streetaddress': '36 Central Park South'}], 'hotel': [{'image': 'https://cf.bstatic.com/xdata/images/hotel/270x200/230061697.webp?k=4a0d40b43a1da01a4352f3d36c73aa32a320442bcc570d836661c63585465095&o=', 'name': '6 Columbus Central Park Hotel', 'url': ""6 Columbus Central Park HotelHotel in Hell's Kitchen, New York""}, {'image': 'https://cf.bstatic.com/xdata/images/hotel/270x200/599569921.webp?k=3df9706ab4f7473c11e454546e0fbf571841cff44d0e2d1707ce7f43142d78a2&o=', 'name': 'Mandarin Oriental, New York', 'url': 'Mandarin Oriental, New YorkHotel in Upper West Side, New York'}, {'image': 'https://cf.bstatic.com/xdata/images/hotel/270x200/517275808.webp?k=81338961c7f7c838effe6acc86f91a49699602f0f8fc943596cbebbcd25feea4&o=', 'name': 'Da Vinci Hotel', 'url': 'Da Vinci HotelHotel in New York'}, {'image': 'https://cf.bstatic.com/xdata/images/hotel/270x200/530964803.webp?k=df3be1d575f9bf1762af18bdece96d68ad3f5c1f86ea49306d725da3bff54024&o=', 'name': 'Comfy Guest House by Columbus Circle', 'url': 'Comfy Guest House by Columbus CircleHotel in New York'}, {'image': 'https://cf.bstatic.com/xdata/images/hotel/270x200/63338224.webp?k=c28959d8a2fd35027eac230d8268064a11c418605ec99a7f052df6f9311d2581&o=', 'name': 'Moderne Hotel', 'url': 'Moderne HotelHotel in New York'}, {'image': 'https://cf.bstatic.com/xdata/images/hotel/270x200/674830918.webp?k=015102e8987c4dce6c60c74bc584f5d07e7366b004f84d992559da5436eedf65&o=', 'name': 'The Manhattan Club', 'url': 'The Manhattan ClubHotel in New York'}, {'image': 'https://cf.bstatic.com/xdata/images/hotel/270x200/422975926.webp?k=c21f444c4495ce5c9cfdd3b47d3d5ce28d60f3ea193146711b272e14fc940b89&o=', 'name': 'The Empire Hotel New York', 'url': 'The Empire Hotel New YorkHotel in Upper West Side, New York'}, {'image': 'https://cf.bstatic.com/xdata/images/hotel/270x200/489199049.webp?k=4ac38c12946eae40806afc8d1e0601637315b662010605fcce7664802eda6ad7&o=', 'name': 'Park Hyatt New York', 'url': 'Park Hyatt New YorkHotel in New York'}, {'image': 'https://cf.bstatic.com/xdata/images/hotel/270x200/626121822.webp?k=cff64bafaf58563e66501414ddf679ca94a3808180edd08aaf55e65c33cd54ee&o=', 'name': 'Great! Private NYC Room in Sunnyside', 'url': 'Great! Private NYC Room in SunnysideHotel in Haberman'}, {'image': 'https://cf.bstatic.com/xdata/images/hotel/270x200/693269230.webp?k=293bbbfb3f1289755181ee599bf82fcb96d8d47e699d49fdefd4cd00ce170e99&o=', 'name': 'Hudson Guest House', 'url': 'Hudson Guest HouseHotel in Jersey City'}, {'image': 'https://cf.bstatic.com/xdata/images/hotel/270x200/584871379.webp?k=52a9bef056dacc9a2f4ea2e0d980aba7ff48340e4d8a1dfc8df650b9b4f8167f&o=', 'name': 'Double queen room 6 minutes walk to Penn station NYC EWR', 'url': 'Double queen room 6 minutes walk to Penn station NYC EWRHotel in Jersey City'}, {'image': 'https://cf.bstatic.com/xdata/images/hotel/270x200/724655366.webp?k=4deb2c4916820eed9982f497467619a7ae3cf02111a3427de274937180b857b1&o=', 'name': 'Cjay home 3', 'url': 'Cjay home 3Hotel in Jersey City'}, {'image': 'https://cf.bstatic.com/xdata/images/hotel/270x200/536021806.webp?k=51f8a40525baf0dc8adb6895d32e904ea0054596e0aba389275160a48ca43b36&o=', 'name': 'Trump International New York', 'url': 'Trump International New YorkHotel in Upper West Side, New York'}, {'image': 'https://cf.bstatic.com/xdata/images/hotel/270x200/756403160.webp?k=add9453539fd0bd4e77c71ab8b6d82fc459ab1808243b5c962f4c75c3dbc0f97&o=', 'name': 'Oasis Room at a Shared Apartment by Times Square', 'url': 'Oasis Room at a Shared Apartment by Times SquareHotel in New York'}, {'image': 'https://cf.bstatic.com/xdata/images/hotel/270x200/756403135.webp?k=09f26d810cbdf5331bd477a878cd78bb5a1b029cd1905fa755423cb4792f57e4&o=', 'name': 'Oasis Room at a Shared Apartment by Times Square', 'url': 'Oasis Room at a Shared Apartment by Times SquareHotel in New York'}, {'image': 'https://cf.bstatic.com/xdata/images/hotel/270x200/756403116.webp?k=43b7ed58cad4e71f79d5478c5a67030a60c62b97b317bd1768e645f576ecfd8c&o=', 'name': 'Private room by Times Square Manhattan', 'url': 'Private room by Times Square ManhattanHotel in New York'}, {'image': 'https://cf.bstatic.com/xdata/images/hotel/270x200/99760688.webp?k=0a9865e84f1430c0e3f2c036e4fffd21f11beb7b3587f1810d05ed362a701c43&o=', 'name': 'WestHouse Hotel New York', 'url': 'WestHouse Hotel New YorkHotel in New York'}, {'image': 'https://cf.bstatic.com/xdata/images/hotel/270x200/756067041.webp?k=d979df11988e4d3984bc1b11d14a51d329420c8b774c295ceaff2281cd218175&o=', 'name': 'Dream Midtown, by Hyatt', 'url': 'Dream Midtown, by HyattHotel in New York'}, {'image': 'https://cf.bstatic.com/xdata/images/hotel/270x200/483618940.webp?k=58ce3866399b449998365dc1660f9d74424df05bfe222305e331822ac4701382&o=', 'name': 'Thompson Central Park New York, by Hyatt', 'url': 'Thompson Central Park New York, by HyattHotel in New York'}, {'image': 'https://cf.bstatic.com/xdata/images/hotel/270x200/569021754.webp?k=cd302c0b5bbc552ac092c97db9ed65e7ee11b980f4efe797488f862933d03312&o=', 'name': 'The Luxury Collection Hotel Manhattan Midtown', 'url': 'The Luxury Collection Hotel Manhattan MidtownHotel in New York'}, {'image': 'https://cf.bstatic.com/xdata/images/hotel/270x200/53049771.webp?k=acf932867b5511cebcc3563b9166a4b901a3188babd008e85782e5b01a5ccf73&o=', 'name': '1 Hotel Central Park', 'url': '1 Hotel Central ParkHotel in New York'}, {'image': 'https://cf.bstatic.com/xdata/images/hotel/270x200/446598387.webp?k=6b64b2e86ffe44565c1def04028ba174992f4fe5b80ca5f3707f4868cc9b3328&o=', 'name': 'The Ritz-Carlton New York, Central Park', 'url': 'The Ritz-Carlton New York, Central ParkHotel in New York'}, {'image': 'https://cf.bstatic.com/xdata/images/hotel/270x200/430226615.webp?k=09abbe4af7c8fd0efe57bdf7533480fff1120a5fc50bfe708dab970570585ae6&o=', 'name': 'Sheraton New York Times Square Hotel', 'url': 'Sheraton New York Times Square HotelHotel in New York'}, {'image': 'https://cf.bstatic.com/xdata/images/hotel/270x200/336418375.webp?k=2ac283e2f1206c3146b6d994f7c79a6f1bb7db983b598a378ce19862f2b5decb&o=', 'name': 'Park Lane New York', 'url': 'Park Lane New YorkHotel in New York'}], 'metatags': [{'twitter:app:id:googleplay': 'com.booking', 'og:image': 'https://cf.bstatic.com/xdata/images/explorer_city/600x200/2309.jpg?k=0c16ca7d143186ca5d14d3e32a8d6514ec203918a82dd63529b1890dbaf6799c&o=', 'twitter:card': 'summary_large_image', 'al:android:package': 'com.booking', 'twitter:app:name:googleplay': 'Booking.com Hotel Reservations', 'twitter:app:id:iphone': '367003839', 'al:ios:url': 'booking://searchresults?dest_id=20088325&dest_type=city&affiliate_id=375119', 'og:description': 'Great savings on hotels in New York, United States online. Good availability and great rates. Read hotel reviews and choose the best hotel deal for your stay.', 'twitter:creator': '@bookingcom', 'al:ios:app_store_id': '367003839', 'twitter:image': 'https://cf.bstatic.com/xdata/images/explorer_city/600x200/2309.jpg?k=0c16ca7d143186ca5d14d3e32a8d6514ec203918a82dd63529b1890dbaf6799c&o=', 'twitter:site': '@bookingcom', 'twitter:title': '2969 hotels in New York, United States.', 'og:type': 'website', 'al:ios:app_name': 'Booking.com Hotel Reservations', 'og:title': '2969 hotels in New York, United States.', 'twitter:app:id:ipad': '367003839', 'al:android:url': 'booking://searchresults?dest_id=20088325&dest_type=city&affiliate_id=375119', 'referrer': 'strict-origin-when-cross-origin', 'booking-verification': 'jPSKdlhk3yXwS0PjQHP5xzADbeS99pJdr4n9M52Q7BseOZ9yiDgoOg-pay6uav2xyAk04tcMEaX6UIFvkrnMN-lzSwpw__do35je67nwC246_tIg0TDyDrwfWQhgNhvejtjWcsQGB9-IPlpy1DQ69g_vKy3-y887MwltkKRO8b8VHHwCfqUSMo7VWh8yP5vGUMm2WRsHcmbv2PSFMPok_2Zw6Ua77bdnHs_fitz0y_II1DGMvT7VrllyPJFoy0LovvJoY-IkrsBo6wk6_5u5AEvVPMqtk29XJHO1KKg-7nPRN0U145JO4uT5RiAErMBma4cQ224-nGhRYyeP6qP-0Oz6TK_R-PPNamPvLzilWMhTlYEJCWde6jHtjENvf7fygf_UCJ0RUvBEkPON2Ob8ri-Awhq9BvckxOSMynJ8cTghHIBjV3xhXrSgajVr1BFjPJmcm2dbBYVTZA8iG_o-ittiUEULcPGj', 'twitter:app:name:ipad': 'Booking.com Hotel Reservations Worldwide & Hotel Deals', 'viewport': 'width=device-width, initial-scale=1.0', 'twitter:description': 'Great savings on hotels in New York, United States online. Good availability and great rates. Read hotel reviews and choose the best hotel deal for your stay.', 'apple-mobile-web-app-capable': 'no', 'name': 'Booking.com', 'position': '1', 'og:url': 'https://www.booking.com/city/us/new-york.html', 'al:android:app_name': 'Booking.com Hotel Reservation', 'apple-touch-fullscreen': 'yes'}], 'cse_image': [{'src': 'https://cf.bstatic.com/xdata/images/explorer_city/600x200/2309.jpg?k=0c16ca7d143186ca5d14d3e32a8d6514ec203918a82dd63529b1890dbaf6799c&o='}], 'listitem': [{'item': 'Home', 'name': 'Home', 'position': '1'}, {'item': 'Hotels', 'name': 'Hotels', 'position': '2'}, {'item': 'United States', 'name': 'United States', 'position': '3'}, {'item': 'New York State (NY)', 'name': 'New York State (NY)', 'position': '4'}, {'name': 'New York', 'position': '5'}]}"
customsearch#result,THE 10 BEST Hotels in New York City 2025 (from $107) - Tripadvisor,THE 10 BEST <b>Hotels</b> in <b>New York</b> City 2025 (from $107) - Tripadvisor,https://www.tripadvisor.com/Hotels-g60763-New_York_City_New_York-Hotels.html,www.tripadvisor.com,"Sep 1, 2025 ... Find the right hotel for you · 1. Motto by Hilton New York City Chelsea · 2. The Evelyn Hotel · 3. Embassy Suites By Hilton New York ...","Sep 1, 2025 <b>...</b> Find the right <b>hotel</b> for you &middot; 1. Motto by Hilton <b>New York</b> City Chelsea &middot; 2. The Evelyn <b>Hotel</b> &middot; 3. Embassy Suites By Hilton <b>New York</b>&nbsp;...",https://www.tripadvisor.com/Hotels-g60763-New_York_City_New_York-...,https://www.tripadvisor.com/<b>Hotels</b>-g60763-<b>New</b>_<b>York</b>_City_<b>New</b>_<b>York</b>-...,"{'cse_thumbnail': [{'src': 'https://encrypted-tbn0.gstatic.com/images?q=tbn:ANd9GcQzSOyuo0o52oOC-V8gmoSpUGWhgnl32YEX3tcB8LW3m0pFb12Wy-TPIKk&s', 'width': '248', 'height': '203'}], 'metatags': [{'twitter:app:url:iphone': 'tripadvisor://www.tripadvisor.com/Hotels-g60763-New_York_City_New_York-Hotels.html?m=33762', 'apple-itunes-app': 'app-id=-1', 'og:image': 'https://media-cdn.tripadvisor.com/media/photo-s/1c/c5/7c/68/caption.jpg', 'theme-color': '#00eb5b', 'og:type': 'website', 'og:image:width': '548', 'og:site_name': 'Tripadvisor', 'al:ios:app_name': 'TripAdvisor', 'twitter:widgets:csp': 'on', 'twitter:app:url:ipad': 'tripadvisor://www.tripadvisor.com/Hotels-g60763-New_York_City_New_York-Hotels.html?m=33762', 'og:title': 'THE 10 BEST Hotels in New York City 2025 (from $107) - Tripadvisor', 'twitter:app:id:ipad': '284876795', 'og:image:height': '450', 'twitter:app:id:iphone': '284876795', 'al:ios:url': 'tripadvisor://www.tripadvisor.com/Hotels-g60763-New_York_City_New_York-Hotels.html?m=33762', 'fb:pages': '5863091683', 'og:description': ""View deals from $107 per night, see photos and read reviews for the best New York City hotels from travelers like you - then compare today's prices from up to 200 sites on Tripadvisor."", 'al:ios:app_store_id': '284876795', 'twitter:image': 'https://media-cdn.tripadvisor.com/media/photo-s/1c/c5/7c/68/caption.jpg', 'viewport': 'width=device-width, initial-scale=1, viewport-fit=cover', 'og:locale': 'en-US', 'og:url': 'https://www.tripadvisor.com/Hotels-g60763-New_York_City_New_York-Hotels.html', 'format-detection': 'telephone=no'}], 'cse_image': [{'src': 'https://media-cdn.tripadvisor.com/media/photo-s/1c/c5/7c/68/caption.jpg'}]}"
customsearch#result,The Plaza Hotel: Luxury Hotel Near Central Park | 5 Star Hotel in NYC,The Plaza <b>Hotel</b>: Luxury <b>Hotel</b> Near Central Park | 5 Star <b>Hotel</b> in <b>NYC</b>,https://www.theplazany.com/,www.theplazany.com,"Ideally situated on Fifth Avenue, The Plaza's prestigious address continues to define elegance with unmatched service and an ever-evolving modern sensibility.","Ideally situated on Fifth Avenue, The Plaza&#39;s prestigious address continues to define elegance with unmatched service and an ever-evolving modern sensibility.",https://www.theplazany.com/,https://www.theplazany.com/,"{'cse_thumbnail': [{'src': 'https://encrypted-tbn0.gstatic.com/images?q=tbn:ANd9GcTT7Ol5DxNwJbQwFgfGqfg1-7tR0lVfohdNk1mq-IMLM4PCJ1rzlCjLHUu2&s', 'width': '328', 'height': '154'}], 'metatags': [{'og:type': 'website', 'twitter:card': 'summary_large_image', 'og:site_name': 'The Plaza', 'twitter:site': '@ThePlazaHotel', 'article:modified_time': '2025-11-10T06:56:54+00:00', 'viewport': 'width=device-width, initial-scale=1', 'og:title': 'Luxury Hotel Near Central Park | 5 Star Hotel in NYC | The Plaza Hotel', 'og:locale': 'en_US', 'og:url': 'https://www.theplazany.com/', 'og:description': 'The Plaza has welcomed guests from around the world to enjoy its magic at the castle on Central Park South for more than 100 years.', 'article:publisher': 'https://www.facebook.com/ThePlazaHotel/'}], 'cse_image': [{'src': 'https://www.theplazany.com/wp-content/uploads/2023/09/plz-exterior-fall-foliage-1920x900-1.jpg'}]}"
customsearch#result,"Hotels in New York City, NY | Marriott Bonvoy Hotels®","<b>Hotels</b> in <b>New York</b> City, <b>NY</b> | Marriott Bonvoy <b>Hotels</b>®",https://www.marriott.com/en-us/destinations/united-states/new-york/new-york-city.mi,www.marriott.com,"Marriott Bonvoy's hotels in New York are strategically located to bring you closer to the heart of it all, whether you're here for business or a family trip.","Marriott Bonvoy&#39;s <b>hotels</b> in <b>New York</b> are strategically located to bring you closer to the heart of it all, whether you&#39;re here for business or a family trip.",https://www.marriott.com/en-us/destinations/.../new-york/new-york-city.mi,https://www.marriott.com/en-us/destinations/.../<b>new</b>-<b>york</b>/<b>new</b>-<b>york</b>-city.mi,"{'cse_thumbnail': [{'src': 'https://encrypted-tbn0.gstatic.com/images?q=tbn:ANd9GcT17d2QIDX6UJgGoJc3fqo1UsQ4gostlXkJxP0chTPR47nT90IzgLanX-8&s', 'width': '300', 'height': '168'}], 'metatags': [{'viewport': 'width=device-width, initial-scale=1.0', 'og:title': 'Hotels in New York City, NY | Marriott Bonvoy Hotels®', 'og:url': 'https://www.marriott.com/en-us/destinations/united-states/new-york/new-york-city.mi', 'og:description': 'Visit New York City, NY your way! Explore restaurants, local attractions and more in your favorite New York City neighborhoods as a Marriott Bonvoy Hotel guest.'}], 'cse_image': [{'src': 'https://cache.marriott.com//is/image/marriotts7prod/sh-ewrsa-breakfast-seating-33300-19001:Wide-Hor?output-quality=90&interpolation=progressive-bilinear;*,*&downsize=715px:*'}]}"
