kind,title,htmlTitle,link,displayLink,snippet,htmlSnippet,formattedUrl,htmlFormattedUrl,pagemap
customsearch#result,New York-New York Hotel & Casino | Las Vegas Strip,New York-<b>New York Hotel</b> &amp; Casino | Las Vegas Strip,https://newyorknewyork.mgmresorts.com/en.html,newyorknewyork.mgmresorts.com,"Oct 24, 2025 ... Join the most exciting action on the Las Vegas Strip at New York-New York, offering stylish accommodations and nonstop thrills.","Oct 24, 2025 <b>...</b> Join the most exciting action on the Las Vegas Strip at <b>New York</b>-<b>New York</b>, offering stylish accommodations and nonstop thrills.",https://newyorknewyork.mgmresorts.com/en.html,https://<b>newyorknewyork</b>.mgmresorts.com/en.html,"{'cse_thumbnail': [{'src': 'https://encrypted-tbn0.gstatic.com/images?q=tbn:ANd9GcTvwhdMj2nO_OvzVypbjfeULQm9a6ahINFwB3YU-S1kn8tbCVM_k28is1M&s', 'width': '259', 'height': '194'}], 'metatags': [{'next-head-count': '11', 'theme-color': '#012F4D', 'viewport': 'width=device-width, initial-scale=1, viewport-fit=cover', 'og:title': 'New York-New York Hotel & Casino | Las Vegas Strip', 'og:locale': 'en_US', 'og:description': 'Join the most exciting action on the Las Vegas Strip at New York-New York, offering stylish accommodations and nonstop thrills. Book direct for best rates.', 'format-detection': 'telephone=no, date=no, email=no, address=no', 'vega-complib-version': 'app@2.0.11'}], 'cse_image': [{'src': 'https://thelibrary.mgmresorts.com/transform/QC91DPqHYMB5/NEW108087679.tif?io=transform:fill,width:824,height:618&format=webp&quality=75'}]}"
customsearch#result,"Hotels in New York, NY - Find Hotels - Hilton","<b>Hotels</b> in <b>New York</b>, <b>NY</b> - Find <b>Hotels</b> - Hilton",https://www.hilton.com/en/locations/usa/new-york/new-york/,www.hilton.com,"Explore Hotels in New York, NY. Search by destination, check the latest prices, or use the interactive map to find the location for your ...","Explore <b>Hotels</b> in <b>New York</b>, <b>NY</b>. Search by destination, check the latest prices, or use the interactive map to find the location for your&nbsp;...",https://www.hilton.com/en/locations/usa/new-york/new-york/,https://www.hilton.com/en/locations/usa/<b>new</b>-<b>york</b>/<b>new</b>-<b>york</b>/,"{'cse_thumbnail': [{'src': 'https://encrypted-tbn0.gstatic.com/images?q=tbn:ANd9GcQHd4lSL5jn-RGOz_ijdeJQuwmuVz3oen-ozrq7I0oGwSagWIo-ExFkBNk&s', 'width': '369', 'height': '137'}], 'metatags': [{'og:image': 'https://www.hilton.com/modules/assets/img/brand/WW/open-graph-image-1137x422.png', 'og:type': 'website', 'locations-category': 'locality', 'twitter:card': 'summary_large_image', 'twitter:title': 'Hotels in New York, NY - Find Hotels - Hilton', 'og:site_name': 'Hilton', 'locations-path': '/locations/usa/new-york/new-york', 'twitter:domain': 'hilton.com', 'twitter:url': 'https://www.hilton.com/en/locations/usa/new-york/new-york/', 'og:title': 'Hotels in New York, NY - Find Hotels - Hilton', 'og:description': 'Explore Hotels in New York, NY. Search by destination, check the latest prices, or use the interactive map to find the location for your next stay. Book direct for the best price and free cancellation.', 'twitter:image': 'https://www.hilton.com/modules/assets/img/brand/WW/open-graph-image-1137x422.png', 'viewport': 'width=device-width', 'twitter:description': 'Explore Hotels in New York, NY. Search by destination, check the latest prices, or use the interactive map to find the location for your next stay. Book direct for the best price and free cancellation.', 'og:url': 'https://www.hilton.com/en/locations/usa/new-york/new-york/'}], 'cse_image': [{'src': 'https://www.hilton.com/modules/assets/img/brand/WW/open-graph-image-1137x422.png'}]}"
customsearch#result,"Top 10 Hotels in New York, NY (from $131) - Competitive Prices ...","Top 10 <b>Hotels</b> in <b>New York</b>, <b>NY</b> (from $131) - Competitive Prices ...",https://www.expedia.com/New-York-Hotels.d178293.Travel-Guide-Hotels,www.expedia.com,"Find 8559 of the best hotels in New York, NY in 2025. Compare room rates, hotel reviews and availability. Most hotels are fully refundable.","Find 8559 of the best <b>hotels</b> in <b>New York</b>, <b>NY</b> in 2025. Compare room rates, <b>hotel</b> reviews and availability. Most <b>hotels</b> are fully refundable.",https://www.expedia.com/New-York-Hotels.d178293.Travel-Guide-Hotels,https://www.expedia.com/<b>New</b>-<b>York</b>-<b>Hotels</b>.d178293.Travel-Guide-<b>Hotels</b>,"{'cse_thumbnail': [{'src': 'https://encrypted-tbn0.gstatic.com/images?q=tbn:ANd9GcTW3t92NPZJPTMXQqoRszAAygIzn1HhDWspNLfD3c2qel8UkLr7S1haIrY&s', 'width': '285', 'height': '177'}], 'metatags': [{'data-fm-seo': 'EM[1335775]', 'og:image': 'https://images.trvl-media.com/place/178293/4ff3810c-d301-4f24-af8b-2337e9d4d10f.jpg?impolicy=fcrop&w=450&h=280&q=medium', 'theme-color': '#000000', 'flex:template-version': '791', 'og:type': 'website', 'flex:template-fm-id': '14949', 'og:site_name': 'Expedia.com', 'og:title': 'Top 10 Hotels in New York, NY (from $131) - Competitive Prices | Expedia', 'og:image:type': 'image/jpeg', 'ewe:page': 'FLEX', 'og:description': 'Find 8,559 of the best hotels in New York, NY in 2025. Compare room rates, hotel reviews and availability. Most hotels are fully refundable.', 'essclientid': 'flex.hotel.Travel-Guide-Hotels', 'viewport': 'width=device-width, initial-scale=1.0', 'apple-mobile-web-app-capable': 'yes', 'flex:page-type': 'Travel-Guide-Hotels', 'mobile-web-app-capable': 'yes', 'og:locale': 'en_US', 'flex:template-id': '1-en_US-Travel-Guide-Hotels-citymc-Blossom-Desktop-Like-HSR', 'og:url': 'https://www.expedia.com/New-York-Hotels.d178293.Travel-Guide-Hotels'}], 'cse_image': [{'src': 'https://images.trvl-media.com/place/178293/4ff3810c-d301-4f24-af8b-2337e9d4d10f.jpg?impolicy=fcrop&w=450&h=280&q=medium'}]}"
customsearch#result,New Yorker by Lotte Hotels | Midtown Manhattan Hotel in NYC,New Yorker by Lotte <b>Hotels</b> | Midtown Manhattan <b>Hotel</b> in <b>NYC</b>,https://www.newyorkerhotel.com/,www.newyorkerhotel.com,"Experience timeless style at New Yorker by Lotte Hotels - iconic Midtown Manhattan stay just steps from Penn Station, Madison Square Garden & Times Square.","Experience timeless style at <b>New</b> Yorker by Lotte <b>Hotels</b> - iconic Midtown Manhattan stay just steps from Penn Station, Madison Square Garden &amp; Times Square.",https://www.newyorkerhotel.com/,https://www.<b>newyork</b>erhotel.com/,"{'cse_thumbnail': [{'src': 'https://encrypted-tbn0.gstatic.com/images?q=tbn:ANd9GcSEC_DXJ5BjKUsTkeoorMlYLazN-xh8XDXpIPsSBLoxCxIBpE_qvRSIdkw&s', 'width': '300', 'height': '156'}], 'metatags': [{'p:domain_verify': 'c2bb94a978acaca34c5eecc00d697453', 'twitter:title': 'New Yorker by Lotte Hotels | Midtown Manhattan Hotel in NYC', 'twitter:card': 'summary', 'og:site_name': 'The New Yorker by Lotte Hotels', 'handheldfriendly': 'True', 'twitter:url': 'https://www.newyorkerhotel.com/', 'og:title': 'New Yorker by Lotte Hotels | Midtown Manhattan Hotel in NYC', 'og:description': 'Experience timeless style at New Yorker by Lotte Hotels - iconic Midtown Manhattan stay just steps from Penn Station, Madison Square Garden & Times Square.', 'facebook-domain-verification': 'tlv10u72965bytn5w6b4387c4fo3vp', 'twitter:site': '@WyndhamNYH', 'viewport': 'width=device-width, initial-scale=1.0', 'twitter:description': 'Experience timeless style at New Yorker by Lotte Hotels - iconic Midtown Manhattan stay just steps from Penn Station, Madison Square Garden & Times Square.', 'mobileoptimized': '320', 'og:locale': 'en', 'og:url': 'https://www.newyorkerhotel.com/'}], 'cse_image': [{'src': 'https://res.cloudinary.com/traveltripperweb/image/upload/c_fit,f_auto,h_300,q_auto,w_300/v1754060060/adqcnpiyikg52ibshhfe.png'}]}"
customsearch#result,Which luxe hotels are people loving in New York these days? : r ...,Which luxe <b>hotels</b> are people loving in <b>New York</b> these days? : r ...,https://www.reddit.com/r/chubbytravel/comments/1n7jro1/which_luxe_hotels_are_people_loving_in_new_york/,www.reddit.com,"Sep 3, 2025 ... Aman New York and Four Seasons Downtown are both fantastic if you want that seamless, high-end experience with top-notch service and amenities ( ...","Sep 3, 2025 <b>...</b> Aman <b>New York</b> and Four Seasons Downtown are both fantastic if you want that seamless, high-end experience with top-notch service and amenities (&nbsp;...",https://www.reddit.com/.../which_luxe_hotels_are_people_loving_in_new_...,https://www.reddit.com/.../which_luxe_<b>hotels</b>_are_people_loving_in_<b>new</b>_...,"{'metatags': [{'og:image': 'https://share.redd.it/preview/post/1n7jro1', 'theme-color': '#000000', 'og:image:width': '1200', 'og:type': 'website', 'og:image:alt': 'An image containing a preview of the post', 'twitter:card': 'summary_large_image', 'twitter:title': 'r/chubbytravel on Reddit: Which luxe hotels are people loving in New York these days?', 'og:site_name': 'Reddit', 'og:title': 'r/chubbytravel on Reddit: Which luxe hotels are people loving in New York these days?', 'og:image:height': '630', 'msapplication-navbutton-color': '#000000', 'og:description': 'Posted by u/alex_travels - 48 votes and 100 comments', 'twitter:image': 'https://share.redd.it/preview/post/1n7jro1', 'apple-mobile-web-app-status-bar-style': 'black', 'twitter:site': '@reddit', 'viewport': 'width=device-width, initial-scale=1, viewport-fit=cover', 'apple-mobile-web-app-capable': 'yes', 'og:ttl': '600', 'og:url': 'https://www.reddit.com/r/chubbytravel/comments/1n7jro1/which_luxe_hotels_are_people_loving_in_new_york/?seeker-session=true'}]}"
customsearch#result,Lotte New York Palace | Hotels in Manhattan | Official Website,Lotte <b>New York</b> Palace | <b>Hotels</b> in Manhattan | Official Website,https://www.lottenypalace.com/,www.lottenypalace.com,"The Lotte New York Palace is the first five-star hotel in NYC's history offering ultra-luxurious amenities, distinctive events spaces, and opulent suites.","The Lotte <b>New York</b> Palace is the first five-star <b>hotel</b> in <b>NYC&#39;s</b> history offering ultra-luxurious amenities, distinctive events spaces, and opulent suites.",https://www.lottenypalace.com/,https://www.lottenypalace.com/,"{'cse_thumbnail': [{'src': 'https://encrypted-tbn0.gstatic.com/images?q=tbn:ANd9GcQ0BaeM3t2nbRtQ51D8B7kAJwS0s8p0-4MVKJUUpIMFDPUuU5cY0sdRMzY&s', 'width': '275', 'height': '183'}], 'metatags': [{'og:image': 'https://symphony.cdn.tambourine.com/lotte-new-york-palace-redesign/media/lotte-ny-palace-gallery-1-666ca7bae788c.jpg', 'theme-color': '#897A69', 'twitter:card': 'summary_large_image', 'og:type': 'website', 'twitter:title': 'Lotte New York Palace | Hotels in Manhattan | Official Website', 'og:site_name': 'Lotte New York Palace', 'viewport': 'width=device-width, initial-scale=1', 'twitter:description': ""The Lotte New York Palace is the first five-star hotel in NYC's history offering ultra-luxurious amenities, distinctive events spaces, and opulent suites."", 'og:title': 'Lotte New York Palace | Hotels in Manhattan | Official Website', 'og:url': 'https://www.lottenypalace.com', 'og:description': ""The Lotte New York Palace is the first five-star hotel in NYC's history offering ultra-luxurious amenities, distinctive events spaces, and opulent suites."", 'twitter:image': 'https://symphony.cdn.tambourine.com/lotte-new-york-palace-redesign/media/lotte-ny-palace-gallery-1-666ca7bae788c.jpg'}], 'cse_image': [{'src': 'https://symphony.cdn.tambourine.com/lotte-new-york-palace-redesign/media/lotte-ny-palace-gallery-1-666ca7bae788c.jpg'}]}"
customsearch#result,THE 10 BEST Hotels in New York City 2025 (from $107) - Tripadvisor,THE 10 BEST <b>Hotels</b> in <b>New York</b> City 2025 (from $107) - Tripadvisor,https://www.tripadvisor.com/Hotels-g60763-New_York_City_New_York-Hotels.html,www.tripadvisor.com,"Sep 1, 2025 ... New York City Hotels · The Bryant Park Hotel. 4.7. (5,387 reviews) · LUMA Hotel Times Square. 4.8. (3,547 reviews) · Casablanca Hotel By ...","Sep 1, 2025 <b>...</b> <b>New York</b> City <b>Hotels</b> &middot; The Bryant Park <b>Hotel</b>. 4.7. (5,387 reviews) &middot; LUMA <b>Hotel</b> Times Square. 4.8. (3,547 reviews) &middot; Casablanca <b>Hotel</b> By&nbsp;...",https://www.tripadvisor.com/Hotels-g60763-New_York_City_New_York-...,https://www.tripadvisor.com/<b>Hotels</b>-g60763-<b>New</b>_<b>York</b>_City_<b>New</b>_<b>York</b>-...,"{'cse_thumbnail': [{'src': 'https://encrypted-tbn0.gstatic.com/images?q=tbn:ANd9GcQzSOyuo0o52oOC-V8gmoSpUGWhgnl32YEX3tcB8LW3m0pFb12Wy-TPIKk&s', 'width': '248', 'height': '203'}], 'metatags': [{'twitter:app:url:iphone': 'tripadvisor://www.tripadvisor.com/Hotels-g60763-New_York_City_New_York-Hotels.html?m=33762', 'apple-itunes-app': 'app-id=-1', 'og:image': 'https://media-cdn.tripadvisor.com/media/photo-s/1c/c5/7c/68/caption.jpg', 'theme-color': '#00eb5b', 'og:type': 'website', 'og:image:width': '548', 'og:site_name': 'Tripadvisor', 'al:ios:app_name': 'TripAdvisor', 'twitter:widgets:csp': 'on', 'twitter:app:url:ipad': 'tripadvisor://www.tripadvisor.com/Hotels-g60763-New_York_City_New_York-Hotels.html?m=33762', 'og:title': 'THE 10 BEST Hotels in New York City 2025 (from $107) - Tripadvisor', 'twitter:app:id:ipad': '284876795', 'og:image:height': '450', 'twitter:app:id:iphone': '284876795', 'al:ios:url': 'tripadvisor://www.tripadvisor.com/Hotels-g60763-New_York_City_New_York-Hotels.html?m=33762', 'fb:pages': '5863091683', 'og:description': ""View deals from $107 per night, see photos and read reviews for the best New York City hotels from travelers like you - then compare today's prices from up to 200 sites on Tripadvisor."", 'al:ios:app_store_id': '284876795', 'twitter:image': 'https://media-cdn.tripadvisor.com/media/photo-s/1c/c5/7c/68/caption.jpg', 'viewport': 'width=device-width, initial-scale=1, viewport-fit=cover', 'og:locale': 'en-US', 'og:url': 'https://www.tripadvisor.com/Hotels-g60763-New_York_City_New_York-Hotels.html', 'format-detection': 'telephone=no'}], 'cse_image': [{'src': 'https://media-cdn.tripadvisor.com/media/photo-s/1c/c5/7c/68/caption.jpg'}]}"
customsearch#result,The Plaza Hotel: Luxury Hotel Near Central Park | 5 Star Hotel in NYC,The Plaza <b>Hotel</b>: Luxury <b>Hotel</b> Near Central Park | 5 Star <b>Hotel</b> in <b>NYC</b>,https://www.theplazany.com/,www.theplazany.com,"As an established staple for lavish society affairs and blockbuster films, The Plaza has welcomed guests from around the world to enjoy its magic at the castle ...","As an established staple for lavish society affairs and blockbuster films, The Plaza has welcomed guests from around the world to enjoy its magic at the castle&nbsp;...",https://www.theplazany.com/,https://www.theplazany.com/,"{'cse_thumbnail': [{'src': 'https://encrypted-tbn0.gstatic.com/images?q=tbn:ANd9GcTT7Ol5DxNwJbQwFgfGqfg1-7tR0lVfohdNk1mq-IMLM4PCJ1rzlCjLHUu2&s', 'width': '328', 'height': '154'}], 'metatags': [{'og:type': 'website', 'twitter:card': 'summary_large_image', 'og:site_name': 'The Plaza', 'twitter:site': '@ThePlazaHotel', 'article:modified_time': '2025-11-10T06:56:54+00:00', 'viewport': 'width=device-width, initial-scale=1', 'og:title': 'Luxury Hotel Near Central Park | 5 Star Hotel in NYC | The Plaza Hotel', 'og:locale': 'en_US', 'og:url': 'https://www.theplazany.com/', 'og:description': 'The Plaza has welcomed guests from around the world to enjoy its magic at the castle on Central Park South for more than 100 years.', 'article:publisher': 'https://www.facebook.com/ThePlazaHotel/'}], 'cse_image': [{'src': 'https://www.theplazany.com/wp-content/uploads/2023/09/plz-exterior-fall-foliage-1920x900-1.jpg'}]}"
customsearch#result,"Hotels in New York City, NY | Marriott Bonvoy Hotels®","<b>Hotels</b> in <b>New York</b> City, <b>NY</b> | Marriott Bonvoy <b>Hotels</b>®",https://www.marriott.com/en-us/destinations/united-states/new-york/new-york-city.mi,www.marriott.com,"Marriott Bonvoy's hotels in New York are strategically located to bring you closer to the heart of it all, whether you're here for business or a family trip.","Marriott Bonvoy&#39;s <b>hotels</b> in <b>New York</b> are strategically located to bring you closer to the heart of it all, whether you&#39;re here for business or a family trip.",https://www.marriott.com/en-us/destinations/.../new-york/new-york-city.mi,https://www.marriott.com/en-us/destinations/.../<b>new</b>-<b>york</b>/<b>new</b>-<b>york</b>-city.mi,"{'cse_thumbnail': [{'src': 'https://encrypted-tbn0.gstatic.com/images?q=tbn:ANd9GcT17d2QIDX6UJgGoJc3fqo1UsQ4gostlXkJxP0chTPR47nT90IzgLanX-8&s', 'width': '300', 'height': '168'}], 'metatags': [{'viewport': 'width=device-width, initial-scale=1.0', 'og:title': 'Hotels in New York City, NY | Marriott Bonvoy Hotels®', 'og:url': 'https://www.marriott.com/en-us/destinations/united-states/new-york/new-york-city.mi', 'og:description': 'Visit New York City, NY your way! Explore restaurants, local attractions and more in your favorite New York City neighborhoods as a Marriott Bonvoy Hotel guest.'}], 'cse_image': [{'src': 'https://cache.marriott.com//is/image/marriotts7prod/sh-ewrsa-breakfast-seating-33300-19001:Wide-Hor?output-quality=90&interpolation=progressive-bilinear;*,*&downsize=715px:*'}]}"
customsearch#result,New York-New York Hotel & Casino | Las Vegas Strip,New York-<b>New York Hotel</b> &amp; Casino | Las Vegas Strip,https://newyorknewyork.mgmresorts.com/en.html,newyorknewyork.mgmresorts.com,"Oct 24, 2025 ... Explore New York-New York. From live music on the Brooklyn Bridge to rowdy evenings around dueling pianos, you're sure to find something for the whole family!","Oct 24, 2025 <b>...</b> Explore <b>New York</b>-<b>New York</b>. From live music on the Brooklyn Bridge to rowdy evenings around dueling pianos, you&#39;re sure to find something for the whole family!",https://newyorknewyork.mgmresorts.com/en.html,https://<b>newyorknewyork</b>.mgmresorts.com/en.html,"{'cse_thumbnail': [{'src': 'https://encrypted-tbn0.gstatic.com/images?q=tbn:ANd9GcTvwhdMj2nO_OvzVypbjfeULQm9a6ahINFwB3YU-S1kn8tbCVM_k28is1M&s', 'width': '259', 'height': '194'}], 'metatags': [{'next-head-count': '11', 'theme-color': '#012F4D', 'viewport': 'width=device-width, initial-scale=1, viewport-fit=cover', 'og:title': 'New York-New York Hotel & Casino | Las Vegas Strip', 'og:locale': 'en_US', 'og:description': 'Join the most exciting action on the Las Vegas Strip at New York-New York, offering stylish accommodations and nonstop thrills. Book direct for best rates.', 'format-detection': 'telephone=no, date=no, email=no, address=no', 'vega-complib-version': 'app@2.0.11'}], 'cse_image': [{'src': 'https://thelibrary.mgmresorts.com/transform/QC91DPqHYMB5/NEW108087679.tif?io=transform:fill,width:824,height:618&format=webp&quality=75'}]}"
customsearch#result,"Hotels in New York, NY - Find Hotels - Hilton","<b>Hotels</b> in <b>New York</b>, <b>NY</b> - Find <b>Hotels</b> - Hilton",https://www.hilton.com/en/locations/usa/new-york/new-york/,www.hilton.com,Showing 1 - 20 of 70 hotels · Tempo by Hilton New York Times Square · Tempo by Hilton New York Times Square · Home2 Suites by Hilton New York ...,Showing 1 - 20 of 70 <b>hotels</b> &middot; Tempo by Hilton <b>New York</b> Times Square &middot; Tempo by Hilton <b>New York</b> Times Square &middot; Home2 Suites by Hilton <b>New York</b>&nbsp;...,https://www.hilton.com/en/locations/usa/new-york/new-york/,https://www.hilton.com/en/locations/usa/<b>new</b>-<b>york</b>/<b>new</b>-<b>york</b>/,"{'cse_thumbnail': [{'src': 'https://encrypted-tbn0.gstatic.com/images?q=tbn:ANd9GcQHd4lSL5jn-RGOz_ijdeJQuwmuVz3oen-ozrq7I0oGwSagWIo-ExFkBNk&s', 'width': '369', 'height': '137'}], 'metatags': [{'og:image': 'https://www.hilton.com/modules/assets/img/brand/WW/open-graph-image-1137x422.png', 'og:type': 'website', 'locations-category': 'locality', 'twitter:card': 'summary_large_image', 'twitter:title': 'Hotels in New York, NY - Find Hotels - Hilton', 'og:site_name': 'Hilton', 'locations-path': '/locations/usa/new-york/new-york', 'twitter:domain': 'hilton.com', 'twitter:url': 'https://www.hilton.com/en/locations/usa/new-york/new-york/', 'og:title': 'Hotels in New York, NY - Find Hotels - Hilton', 'og:description': 'Explore Hotels in New York, NY. Search by destination, check the latest prices, or use the interactive map to find the location for your next stay. Book direct for the best price and free cancellation.', 'twitter:image': 'https://www.hilton.com/modules/assets/img/brand/WW/open-graph-image-1137x422.png', 'viewport': 'width=device-width', 'twitter:description': 'Explore Hotels in New York, NY. Search by destination, check the latest prices, or use the interactive map to find the location for your next stay. Book direct for the best price and free cancellation.', 'og:url': 'https://www.hilton.com/en/locations/usa/new-york/new-york/'}], 'cse_image': [{'src': 'https://www.hilton.com/modules/assets/img/brand/WW/open-graph-image-1137x422.png'}]}"
customsearch#result,"Top 10 Hotels in New York, NY (from $131) - Competitive Prices ...","Top 10 <b>Hotels</b> in <b>New York</b>, <b>NY</b> (from $131) - Competitive Prices ...",https://www.expedia.com/New-York-Hotels.d178293.Travel-Guide-Hotels,www.expedia.com,"Compare 8,559 hotels, room rates, hotel reviews and availability. Most hotels are fully refundable. · PUBLIC, an Ian Schrager hotel · Arlo Midtown · Pod Times ...","Compare 8,559 <b>hotels</b>, room rates, <b>hotel</b> reviews and availability. Most <b>hotels</b> are fully refundable. &middot; PUBLIC, an Ian Schrager <b>hotel</b> &middot; Arlo Midtown &middot; Pod Times&nbsp;...",https://www.expedia.com/New-York-Hotels.d178293.Travel-Guide-Hotels,https://www.expedia.com/<b>New</b>-<b>York</b>-<b>Hotels</b>.d178293.Travel-Guide-<b>Hotels</b>,"{'cse_thumbnail': [{'src': 'https://encrypted-tbn0.gstatic.com/images?q=tbn:ANd9GcTW3t92NPZJPTMXQqoRszAAygIzn1HhDWspNLfD3c2qel8UkLr7S1haIrY&s', 'width': '285', 'height': '177'}], 'metatags': [{'data-fm-seo': 'EM[1335775]', 'og:image': 'https://images.trvl-media.com/place/178293/4ff3810c-d301-4f24-af8b-2337e9d4d10f.jpg?impolicy=fcrop&w=450&h=280&q=medium', 'theme-color': '#000000', 'flex:template-version': '791', 'og:type': 'website', 'flex:template-fm-id': '14949', 'og:site_name': 'Expedia.com', 'og:title': 'Top 10 Hotels in New York, NY (from $131) - Competitive Prices | Expedia', 'og:image:type': 'image/jpeg', 'ewe:page': 'FLEX', 'og:description': 'Find 8,559 of the best hotels in New York, NY in 2025. Compare room rates, hotel reviews and availability. Most hotels are fully refundable.', 'essclientid': 'flex.hotel.Travel-Guide-Hotels', 'viewport': 'width=device-width, initial-scale=1.0', 'apple-mobile-web-app-capable': 'yes', 'flex:page-type': 'Travel-Guide-Hotels', 'mobile-web-app-capable': 'yes', 'og:locale': 'en_US', 'flex:template-id': '1-en_US-Travel-Guide-Hotels-citymc-Blossom-Desktop-Like-HSR', 'og:url': 'https://www.expedia.com/New-York-Hotels.d178293.Travel-Guide-Hotels'}], 'cse_image': [{'src': 'https://images.trvl-media.com/place/178293/4ff3810c-d301-4f24-af8b-2337e9d4d10f.jpg?impolicy=fcrop&w=450&h=280&q=medium'}]}"
customsearch#result,New Yorker by Lotte Hotels | Midtown Manhattan Hotel in NYC,New Yorker by Lotte <b>Hotels</b> | Midtown Manhattan <b>Hotel</b> in <b>NYC</b>,https://www.newyorkerhotel.com/,www.newyorkerhotel.com,Offering an upscale stay in a historical icon. Our wide array of Art Deco-inspired rooms and suites is accented by personal touches and city views.,Offering an upscale stay in a historical icon. Our wide array of Art Deco-inspired rooms and suites is accented by personal touches and city views.,https://www.newyorkerhotel.com/,https://www.<b>newyork</b>erhotel.com/,"{'cse_thumbnail': [{'src': 'https://encrypted-tbn0.gstatic.com/images?q=tbn:ANd9GcSEC_DXJ5BjKUsTkeoorMlYLazN-xh8XDXpIPsSBLoxCxIBpE_qvRSIdkw&s', 'width': '300', 'height': '156'}], 'metatags': [{'p:domain_verify': 'c2bb94a978acaca34c5eecc00d697453', 'twitter:title': 'New Yorker by Lotte Hotels | Midtown Manhattan Hotel in NYC', 'twitter:card': 'summary', 'og:site_name': 'The New Yorker by Lotte Hotels', 'handheldfriendly': 'True', 'twitter:url': 'https://www.newyorkerhotel.com/', 'og:title': 'New Yorker by Lotte Hotels | Midtown Manhattan Hotel in NYC', 'og:description': 'Experience timeless style at New Yorker by Lotte Hotels - iconic Midtown Manhattan stay just steps from Penn Station, Madison Square Garden & Times Square.', 'facebook-domain-verification': 'tlv10u72965bytn5w6b4387c4fo3vp', 'twitter:site': '@WyndhamNYH', 'viewport': 'width=device-width, initial-scale=1.0', 'twitter:description': 'Experience timeless style at New Yorker by Lotte Hotels - iconic Midtown Manhattan stay just steps from Penn Station, Madison Square Garden & Times Square.', 'mobileoptimized': '320', 'og:locale': 'en', 'og:url': 'https://www.newyorkerhotel.com/'}], 'cse_image': [{'src': 'https://res.cloudinary.com/traveltripperweb/image/upload/c_fit,f_auto,h_300,q_auto,w_300/v1754060060/adqcnpiyikg52ibshhfe.png'}]}"
